{
  "dataset_id": "idrid",
  "entries": [
    {
      "eye_id": null,
      "followup_id": null,
      "image_path": "A. Segmentation/1. Original Images/a. Training Set/IDRiD_03.jpg",
      "intervention_pair_id": null,
      "labels": [
        {
          "relative_path": "A. Segmentation/2. All Segmentation Groundtruths/a. Training Set/1. Microaneurysms/IDRiD_03_MA.tif",
          "schema_version": "2.0.0",
          "semantic": "MICROANEURYSM_MASK"
        },
        {
          "relative_path": "A. Segmentation/2. All Segmentation Groundtruths/a. Training Set/4. Soft Exudates/IDRiD_03_SE.tif",
          "schema_version": "2.0.0",
          "semantic": "SOFT_EXUDATE_MASK"
        }
      ],
      "patient_id": null,
      "schema_version": "2.0.0",
      "source_image_id": "idrid-segmentation-IDRiD_03",
      "split": "TRAIN"
    },
    {
      "eye_id": null,
      "followup_id": null,
      "image_path": "A. Segmentation/1. Original Images/a. Training Set/IDRiD_08.jpg",
      "intervention_pair_id": null,
      "labels": [
        {
          "relative_path": "A. Segmentation/2. All Segmentation Groundtruths/a. Training Set/1. Microaneurysms/IDRiD_08_MA.tif",
          "schema_version": "2.0.0",
          "semantic": "MICROANEURYSM_MASK"
        },
        {
          "relative_path": "A. Segmentation/2. All Segmentation Groundtruths/a. Training Set/4. Soft Exudates/IDRiD_08_SE.tif",
          "schema_version": "2.0.0",
          "semantic": "SOFT_EXUDATE_MASK"
        }
      ],
      "patient_id": null,
      "schema_version": "2.0.0",
      "source_image_id": "idrid-segmentation-IDRiD_08",
      "split": "TRAIN"
    },
    {
      "eye_id": null,
      "followup_id": null,
      "image_path": "A. Segmentation/1. Original Images/a. Training Set/IDRiD_13.jpg",
      "intervention_pair_id": null,
      "labels": [
        {
          "relative_path": "A. Segmentation/2. All Segmentation Groundtruths/a. Training Set/1. Microaneurysms/IDRiD_13_MA.tif",
          "schema_version": "2.0.0",
          "semantic": "MICROANEURYSM_MASK"
        },
        {
          "relative_path": "A. Segmentation/2. All Segmentation Groundtruths/a. Training Set/4. Soft Exudates/IDRiD_13_SE.tif",
          "schema_version": "2.0.0",
          "semantic": "SOFT_EXUDATE_MASK"
        }
      ],
      "patient_id": null,
      "schema_version": "2.0.0",
      "source_image_id": "idrid-segmentation-IDRiD_13",
      "split": "TRAIN"
    },
    {
      "eye_id": null,
      "followup_id": null,
      "image_path": "A. Segmentation/1. Original Images/a. Training Set/IDRiD_14.jpg",
      "intervention_pair_id": null,
      "labels": [
        {
          "relative_path": "A. Segmentation/2. All Segmentation Groundtruths/a. Training Set/1. Microaneurysms/IDRiD_14_MA.tif",
          "schema_version": "2.0.0",
          "semantic": "MICROANEURYSM_MASK"
        },
        {
          "relative_path": "A. Segmentation/2. All Segmentation Groundtruths/a. Training Set/4. Soft Exudates/IDRiD_14_SE.tif",
          "schema_version": "2.0.0",
          "semantic": "SOFT_EXUDATE_MASK"
        }
      ],
      "patient_id": null,
      "schema_version": "2.0.0",
      "source_image_id": "idrid-segmentation-IDRiD_14",
      "split": "TRAIN"
    },
    {
      "eye_id": null,
      "followup_id": null,
      "image_path": "A. Segmentation/1. Original Images/a. Training Set/IDRiD_17.jpg",
      "intervention_pair_id": null,
      "labels": [
        {
          "relative_path": "A. Segmentation/2. All Segmentation Groundtruths/a. Training Set/1. Microaneurysms/IDRiD_17_MA.tif",
          "schema_version": "2.0.0",
          "semantic": "MICROANEURYSM_MASK"
        },
        {
          "relative_path": "A. Segmentation/2. All Segmentation Groundtruths/a. Training Set/4. Soft Exudates/IDRiD_17_SE.tif",
          "schema_version": "2.0.0",
          "semantic": "SOFT_EXUDATE_MASK"
        }
      ],
      "patient_id": null,
      "schema_version": "2.0.0",
      "source_image_id": "idrid-segmentation-IDRiD_17",
      "split": "TRAIN"
    },
    {
      "eye_id": null,
      "followup_id": null,
      "image_path": "A. Segmentation/1. Original Images/a. Training Set/IDRiD_18.jpg",
      "intervention_pair_id": null,
      "labels": [
        {
          "relative_path": "A. Segmentation/2. All Segmentation Groundtruths/a. Training Set/1. Microaneurysms/IDRiD_18_MA.tif",
          "schema_version": "2.0.0",
          "semantic": "MICROANEURYSM_MASK"
        },
        {
          "relative_path": "A. Segmentation/2. All Segmentation Groundtruths/a. Training Set/4. Soft Exudates/IDRiD_18_SE.tif",
          "schema_version": "2.0.0",
          "semantic": "SOFT_EXUDATE_MASK"
        }
      ],
      "patient_id": null,
      "schema_version": "2.0.0",
      "source_image_id": "idrid-segmentation-IDRiD_18",
      "split": "TRAIN"
    },
    {
      "eye_id": null,
      "followup_id": null,
      "image_path": "A. Segmentation/1. Original Images/a. Training Set/IDRiD_19.jpg",
      "intervention_pair_id": null,
      "labels": [
        {
          "relative_path": "A. Segmentation/2. All Segmentation Groundtruths/a. Training Set/1. Microaneurysms/IDRiD_19_MA.tif",
          "schema_version": "2.0.0",
          "semantic": "MICROANEURYSM_MASK"
        },
        {
          "relative_path": "A. Segmentation/2. All Segmentation Groundtruths/a. Training Set/4. Soft Exudates/IDRiD_19_SE.tif",
          "schema_version": "2.0.0",
          "semantic": "SOFT_EXUDATE_MASK"
        }
      ],
      "patient_id": null,
      "schema_version": "2.0.0",
      "source_image_id": "idrid-segmentation-IDRiD_19",
      "split": "CALIBRATION"
    },
    {
      "eye_id": null,
      "followup_id": null,
      "image_path": "A. Segmentation/1. Original Images/a. Training Set/IDRiD_22.jpg",
      "intervention_pair_id": null,
      "labels": [
        {
          "relative_path": "A. Segmentation/2. All Segmentation Groundtruths/a. Training Set/1. Microaneurysms/IDRiD_22_MA.tif",
          "schema_version": "2.0.0",
          "semantic": "MICROANEURYSM_MASK"
        },
        {
          "relative_path": "A. Segmentation/2. All Segmentation Groundtruths/a. Training Set/4. Soft Exudates/IDRiD_22_SE.tif",
          "schema_version": "2.0.0",
          "semantic": "SOFT_EXUDATE_MASK"
        }
      ],
      "patient_id": null,
      "schema_version": "2.0.0",
      "source_image_id": "idrid-segmentation-IDRiD_22",
      "split": "TRAIN"
    },
    {
      "eye_id": null,
      "followup_id": null,
      "image_path": "A. Segmentation/1. Original Images/a. Training Set/IDRiD_23.jpg",
      "intervention_pair_id": null,
      "labels": [
        {
          "relative_path": "A. Segmentation/2. All Segmentation Groundtruths/a. Training Set/1. Microaneurysms/IDRiD_23_MA.tif",
          "schema_version": "2.0.0",
          "semantic": "MICROANEURYSM_MASK"
        },
        {
          "relative_path": "A. Segmentation/2. All Segmentation Groundtruths/a. Training Set/4. Soft Exudates/IDRiD_23_SE.tif",
          "schema_version": "2.0.0",
          "semantic": "SOFT_EXUDATE_MASK"
        }
      ],
      "patient_id": null,
      "schema_version": "2.0.0",
      "source_image_id": "idrid-segmentation-IDRiD_23",
      "split": "CALIBRATION"
    },
    {
      "eye_id": null,
      "followup_id": null,
      "image_path": "A. Segmentation/1. Original Images/a. Training Set/IDRiD_25.jpg",
      "intervention_pair_id": null,
      "labels": [
        {
          "relative_path": "A. Segmentation/2. All Segmentation Groundtruths/a. Training Set/1. Microaneurysms/IDRiD_25_MA.tif",
          "schema_version": "2.0.0",
          "semantic": "MICROANEURYSM_MASK"
        },
        {
          "relative_path": "A. Segmentation/2. All Segmentation Groundtruths/a. Training Set/4. Soft Exudates/IDRiD_25_SE.tif",
          "schema_version": "2.0.0",
          "semantic": "SOFT_EXUDATE_MASK"
        }
      ],
      "patient_id": null,
      "schema_version": "2.0.0",
      "source_image_id": "idrid-segmentation-IDRiD_25",
      "split": "TRAIN"
    },
    {
      "eye_id": null,
      "followup_id": null,
      "image_path": "A. Segmentation/1. Original Images/a. Training Set/IDRiD_30.jpg",
      "intervention_pair_id": null,
      "labels": [
        {
          "relative_path": "A. Segmentation/2. All Segmentation Groundtruths/a. Training Set/1. Microaneurysms/IDRiD_30_MA.tif",
          "schema_version": "2.0.0",
          "semantic": "MICROANEURYSM_MASK"
        },
        {
          "relative_path": "A. Segmentation/2. All Segmentation Groundtruths/a. Training Set/4. Soft Exudates/IDRiD_30_SE.tif",
          "schema_version": "2.0.0",
          "semantic": "SOFT_EXUDATE_MASK"
        }
      ],
      "patient_id": null,
      "schema_version": "2.0.0",
      "source_image_id": "idrid-segmentation-IDRiD_30",
      "split": "TRAIN"
    },
    {
      "eye_id": null,
      "followup_id": null,
      "image_path": "A. Segmentation/1. Original Images/a. Training Set/IDRiD_31.jpg",
      "intervention_pair_id": null,
      "labels": [
        {
          "relative_path": "A. Segmentation/2. All Segmentation Groundtruths/a. Training Set/1. Microaneurysms/IDRiD_31_MA.tif",
          "schema_version": "2.0.0",
          "semantic": "MICROANEURYSM_MASK"
        },
        {
          "relative_path": "A. Segmentation/2. All Segmentation Groundtruths/a. Training Set/4. Soft Exudates/IDRiD_31_SE.tif",
          "schema_version": "2.0.0",
          "semantic": "SOFT_EXUDATE_MASK"
        }
      ],
      "patient_id": null,
      "schema_version": "2.0.0",
      "source_image_id": "idrid-segmentation-IDRiD_31",
      "split": "TRAIN"
    },
    {
      "eye_id": null,
      "followup_id": null,
      "image_path": "A. Segmentation/1. Original Images/a. Training Set/IDRiD_32.jpg",
      "intervention_pair_id": null,
      "labels": [
        {